{
  "authoring": {
    "path": "daily-authoring/2026-08-17.json",
    "semanticSha256": "a6d209b4fd7088d303f56d49cd054c4d729945d8d9689b36840ae7982d7bcba3",
    "sha256": "310a270a49236174f8bea392aae81f8f044557dd725f02c285f4a0d7e414daad"
  },
  "canonManifest": {
    "path": "source-of-truth/canon_manifest.json",
    "sha256": "c454839e632654fe2473b08cf65937e158f27774ac6c6fcb430a57450356d9cd"
  },
  "causalDossier": {
    "path": "research/2026-08-17/causal_research_dossier_2026-08-17.json",
    "sha256": "1d490a22333e39a3972e11ea7378a885c1f34458da0b357bcc1f2f10e6281992"
  },
  "causalDossierValidation": {
    "path": "research/2026-08-17/causal_dossier_validation.json",
    "sha256": "67fb914792121795fd5a97e63e63c49a9fe5e3ac8f0faf74bede31d2ab79d93c"
  },
  "contractBindings": [
    {
      "path": "contracts/chatgpt_daily_authoring_v2.schema.json",
      "role": "daily-authoring-schema",
      "sha256": "5f47240ab61a7bc99c2478d86aae6f858047ab2da58a439343317aaee2ed6c7e"
    },
    {
      "path": "contracts/editorial_semantic_acceptance.schema.json",
      "role": "semantic-acceptance-schema",
      "sha256": "5ecc1e30a4ab4cf5bc6d3ba8ad68c85aed0d63cb1f3897e36470b3eed45003cb"
    },
    {
      "path": "skills/nasdaq-cafe-causal-research/contracts/causal_research_dossier_v0.3.schema.json",
      "role": "dossier-schema",
      "sha256": "6d9cf26650d8d1313f3bf7863a418b4b9ab8469755e4834680432ca4797dfc2f"
    },
    {
      "path": "skills/nasdaq-cafe-causal-research/contracts/causal_dossier_validation_receipt.schema.json",
      "role": "dossier-receipt-schema",
      "sha256": "ecfccad0f4b6e058762e32cb3e8d2bad3406c9161a69492a0fe419558239d6ef"
    },
    {
      "path": "skills/nasdaq-cafe-causal-research/validators/validate_causal_research_dossier.py",
      "role": "dossier-validator",
      "sha256": "46694347d0ae0095894d11e377df1aabd4a53b259eb40844432cd7fd1c7f4cbb"
    },
    {
      "path": "scripts/materialize_causal_research.py",
      "role": "dossier-receipt-verifier",
      "sha256": "b52f87500395fd3c1e905ed63e5ab9c3a25b955d61aea25a5dd15412a1a35eac"
    },
    {
      "path": "scripts/canon_manifest.py",
      "role": "canon-manifest-verifier",
      "sha256": "0506163818c81c526de2fe199354db2829ad1ee3dab5858d078930f179d985ad"
    },
    {
      "path": "contracts/canon_manifest.schema.json",
      "role": "canon-manifest-schema",
      "sha256": "46a8984eaf5c4de447450053ae9886e4cc036797c0c8730ce89419cd821d4d6d"
    },
    {
      "path": "skills/nasdaq-cafe-story-plan/contracts/story_plan.schema.json",
      "role": "story-plan-schema",
      "sha256": "84e7a4fd7c2f17f2d02c2487ff6da8dbee1f5112d0ac786cf38aa2ce664c1521"
    },
    {
      "path": "skills/nasdaq-cafe-story-plan/validators/validate_story_plan.py",
      "role": "story-plan-validator",
      "sha256": "d7ab21816837ad0105d8a780c6f2104a42301a319e68992bfc33ab69f5e31ba6"
    },
    {
      "path": "skills/nasdaq-cafe-story-authoring/contracts/story_script.schema.json",
      "role": "story-script-schema",
      "sha256": "2777cdf9a76435d551841670b8982778ae11fe9d011ff686213b46137c521c24"
    },
    {
      "path": "scripts/story-engine/validate_story_engine_bundle.py",
      "role": "story-bundle-validator",
      "sha256": "9ac182c8e20699c935a059ac7b18362ccb70b2c9ce481f30f5aa7b5ba0e0314e"
    },
    {
      "path": "skills/nasdaq-cafe-entertainment-critic/contracts/creative_review.schema.json",
      "role": "creative-review-schema",
      "sha256": "464f2e96df5e68d8b058db0f92212bc0f7c11194923fbb767ee3adefe77347a5"
    },
    {
      "path": "scripts/validate_editorial_semantic_boundary.py",
      "role": "semantic-boundary-validator",
      "sha256": "97294649b60c2b5b9aa2a3ba143325c1a1888629a8cc86e301ec1bea0374d617"
    }
  ],
  "contractVersion": "1.0.0",
  "episodeDate": "2026-08-17",
  "errors": [],
  "status": "PASS",
  "storySubdocuments": {
    "creativeReview": {
      "jsonPointer": "/creativeReview",
      "semanticSha256": "bc1cdf3c516659d6d4ac6192e9e4613d167e038a75ed9c810cca8d1ffdf1301f"
    },
    "storyPlan": {
      "jsonPointer": "/storyPlan",
      "semanticSha256": "8a3d138d4dcd498a8e20a817a43e5fad5bb46806ea59c63b39e36a72219d8c82"
    },
    "storyScript": {
      "jsonPointer": "/storyScript",
      "semanticSha256": "cee610485a07f42a15355c1afcfae3f1ef61d010a9eeabba04c83dffc5832ee6"
    }
  },
  "validationProjections": {
    "creativeReview": {
      "path": "verification/2026-08-17/editorial-semantic-preflight/creative_review.json",
      "sha256": "4566caa354eccb29c2c0af0e2ec4acecd53c8a1dbf4ee56494b2fb35e8e441fb"
    },
    "storyPlan": {
      "path": "verification/2026-08-17/editorial-semantic-preflight/story_plan.json",
      "sha256": "5de4b246953c890d7075adfdc03771b0c0b85b6049f16f6061ee8c65cd48ef00"
    },
    "storyScript": {
      "path": "verification/2026-08-17/editorial-semantic-preflight/story_script.json",
      "sha256": "fc19458cb3dbd6c9812d680ff3ea97b1f6760ca7cb39185887d6de272a4b90fb"
    }
  }
}
